{
  "schemaVersion": "1.0",
  "id": "1fe837a4-3c86-3034-8f05-52232cedb339",
  "observation": {
    "schemaVersion": "1.0",
    "tenantId": "tenant-demo",
    "sourceInstanceId": "zabbix-1",
    "problemEventId": "30001",
    "triggerId": "40001",
    "title": "Fixture: CPU threshold exceeded",
    "severity": 3,
    "occurredAt": "2026-09-21T12:00:00Z",
    "observedAt": "2026-09-25T00:00:00Z",
    "hostIds": [
      "10084"
    ],
    "suppressed": false,
    "recoveryEventId": "30003",
    "recoveredAt": "2026-09-21T12:10:00Z",
    "state": "RECOVERED",
    "gaps": []
  },
  "dataMode": "labeled-fixture",
  "sourceContract": "zabbix-7.0-event-v1",
  "firstReceivedAt": "2026-09-25T00:00:01.123456789Z",
  "entities": [
    {
      "hostId": "10084",
      "entityId": "11111111-1111-1111-1111-111111111111"
    }
  ],
  "gaps": []
}
